{
  "$schema": "https://json-schema.org/draft/2020-12/schema",
  "$id": "scq://schema/digest",
  "title": "Digest configuration",
  "description": "Controls the cadence, scope, and recipients of the arXiv digest. Schedule timing comes from the GitHub Actions cron line; this file controls the digest's content and delivery.",
  "type": "object",
  "additionalProperties": false,
  "properties": {
    "$schema": { "type": "string" },
    "cadence": {
      "type": "string",
      "enum": ["daily", "weekly", "manual"],
      "description": "Hint for which cron schedule to use. The actual schedule lives in .github/workflows/arxiv_digest.yml."
    },
    "dayOfWeek": {
      "type": "string",
      "enum": ["mon", "tue", "wed", "thu", "fri", "sat", "sun"],
      "description": "Used when cadence is 'weekly'."
    },
    "timeOfDay": {
      "type": "string",
      "pattern": "^([01]\\d|2[0-3]):[0-5]\\d$",
      "description": "HH:MM in 24-hour UTC."
    },
    "maxPapers": {
      "type": ["integer", "null"],
      "minimum": 1,
      "maximum": 200,
      "description": "Cap on how many papers appear in one digest, after relevance ranking. Null means no cap."
    },
    "lookbackDays": {
      "type": "integer",
      "minimum": 1,
      "maximum": 30
    },
    "minRelevanceScore": {
      "type": "integer",
      "minimum": 0,
      "description": "Drop papers whose summed keyword weight falls below this floor."
    },
    "includeSources": {
      "type": "array",
      "items": { "type": "string" },
      "uniqueItems": true,
      "description": "Source IDs (from search-sources.json) to include. Empty array = use all enabled sources."
    },
    "recipients": {
      "type": "array",
      "x-mergeKey": "email",
      "items": {
        "type": "object",
        "additionalProperties": false,
        "required": ["email"],
        "properties": {
          "email": { "type": "string", "format": "email" },
          "name": { "type": "string" },
          "frequency": {
            "type": "string",
            "enum": ["daily", "weekly", "both"],
            "description": "Which digests this recipient gets. Defaults to 'daily'."
          },
          "enabled": {
            "type": "boolean",
            "description": "Defaults to true. Set false to silence one address without removing it."
          }
        }
      },
      "description": "Recipients of the digest. Each entry has at least an email; optional name, frequency, enabled. Production CI also honors the SCQ_EMAIL_TO env var as a fallback when no recipients are configured here."
    },
    "sendWhenEmpty": {
      "type": "boolean",
      "description": "Send a short 'no new papers' email when a run finds nothing to report. Keeps silence meaningful: with this on, no email in your inbox always means the pipeline broke, never that arXiv was quiet. Set false to hear from the digest only when there are papers."
    },
    "subjectPrefix": {
      "type": "string",
      "maxLength": 40
    },
    "rankingMode": {
      "type": "string",
      "enum": ["simple", "smart"],
      "default": "smart",
      "description": "simple = flat keyword matching (no profiles, no author boosts). smart = profile-based scoring with focus multipliers and author boosts."
    }
  },
  "required": ["cadence", "lookbackDays"]
}
