{
  "$schema": "../schema/digest.schema.json",
  "cadence": "daily",
  "dayOfWeek": "mon",
  "timeOfDay": "07:00",
  "maxPapers": null,
  "lookbackDays": 1,
  "minRelevanceScore": 5,
  "includeSources": ["arxiv"],
  "recipients": [],
  "sendWhenEmpty": true,
  "subjectPrefix": "[SCQ digest]",
  "rankingMode": "smart"
}
